{
  "agents": [
    {
      "agent_id": "a0402430-e269-4d95-93ee-621eb27bcafd",
      "agent_name": "UNKNOWN",
      "tier": "BLACKHOLE"
    },
    {
      "agent_id": "2752f5c3-7930-4b54-880e-dc84c90ccf4a",
      "agent_name": "UNKNOWN",
      "tier": "YELLOW"
    },
    {
      "agent_id": "001ef143-89b8-45bc-bf74-74ba1e415aad",
      "agent_name": "UNKNOWN",
      "tier": "YELLOW"
    },
    {
      "agent_id": "37395390-006b-469c-9a61-4c27bcb011a3",
      "agent_name": "UNKNOWN",
      "tier": "YELLOW"
    },
    {
      "agent_id": "03a16db0-59aa-4eb9-9ed1-eb0cf4db64c7",
      "agent_name": "UNKNOWN",
      "tier": "YELLOW"
    },
    {
      "agent_id": "2ebdb769-7004-4729-b923-7acc8cf054b7",
      "agent_name": "UNKNOWN",
      "tier": "BLACKHOLE"
    },
    {
      "agent_id": "c3c5862f-8c0e-42fa-bf67-05b2730bddf2",
      "agent_name": "UNKNOWN",
      "tier": "YELLOW"
    },
    {
      "agent_id": "8cc766fb-4816-4398-bd7a-9ebab7e71798",
      "agent_name": "UNKNOWN",
      "tier": "BLACKHOLE"
    },
    {
      "agent_id": "2125ecac-d184-422b-a17b-3cade679f01b",
      "agent_name": "UNKNOWN",
      "tier": "YELLOW"
    }
  ],
  "coordination_edges": [
    {
      "allowed": false,
      "from_agent_id": "a0402430-e269-4d95-93ee-621eb27bcafd",
      "reason": "Tier mismatch: BLACKHOLE -> YELLOW",
      "to_agent_id": "2752f5c3-7930-4b54-880e-dc84c90ccf4a"
    },
    {
      "allowed": false,
      "from_agent_id": "a0402430-e269-4d95-93ee-621eb27bcafd",
      "reason": "Tier mismatch: BLACKHOLE -> YELLOW",
      "to_agent_id": "001ef143-89b8-45bc-bf74-74ba1e415aad"
    },
    {
      "allowed": false,
      "from_agent_id": "a0402430-e269-4d95-93ee-621eb27bcafd",
      "reason": "Tier mismatch: BLACKHOLE -> YELLOW",
      "to_agent_id": "37395390-006b-469c-9a61-4c27bcb011a3"
    },
    {
      "allowed": false,
      "from_agent_id": "a0402430-e269-4d95-93ee-621eb27bcafd",
      "reason": "Tier mismatch: BLACKHOLE -> YELLOW",
      "to_agent_id": "03a16db0-59aa-4eb9-9ed1-eb0cf4db64c7"
    },
    {
      "allowed": false,
      "from_agent_id": "a0402430-e269-4d95-93ee-621eb27bcafd",
      "reason": "Tier mismatch: BLACKHOLE -> BLACKHOLE",
      "to_agent_id": "2ebdb769-7004-4729-b923-7acc8cf054b7"
    },
    {
      "allowed": false,
      "from_agent_id": "a0402430-e269-4d95-93ee-621eb27bcafd",
      "reason": "Tier mismatch: BLACKHOLE -> YELLOW",
      "to_agent_id": "c3c5862f-8c0e-42fa-bf67-05b2730bddf2"
    },
    {
      "allowed": false,
      "from_agent_id": "a0402430-e269-4d95-93ee-621eb27bcafd",
      "reason": "Tier mismatch: BLACKHOLE -> BLACKHOLE",
      "to_agent_id": "8cc766fb-4816-4398-bd7a-9ebab7e71798"
    },
    {
      "allowed": false,
      "from_agent_id": "a0402430-e269-4d95-93ee-621eb27bcafd",
      "reason": "Tier mismatch: BLACKHOLE -> YELLOW",
      "to_agent_id": "2125ecac-d184-422b-a17b-3cade679f01b"
    },
    {
      "allowed": false,
      "from_agent_id": "2752f5c3-7930-4b54-880e-dc84c90ccf4a",
      "reason": "Tier mismatch: YELLOW -> BLACKHOLE",
      "to_agent_id": "a0402430-e269-4d95-93ee-621eb27bcafd"
    },
    {
      "allowed": false,
      "from_agent_id": "2752f5c3-7930-4b54-880e-dc84c90ccf4a",
      "reason": "Tier mismatch: YELLOW -> YELLOW",
      "to_agent_id": "001ef143-89b8-45bc-bf74-74ba1e415aad"
    },
    {
      "allowed": false,
      "from_agent_id": "2752f5c3-7930-4b54-880e-dc84c90ccf4a",
      "reason": "Tier mismatch: YELLOW -> YELLOW",
      "to_agent_id": "37395390-006b-469c-9a61-4c27bcb011a3"
    },
    {
      "allowed": false,
      "from_agent_id": "2752f5c3-7930-4b54-880e-dc84c90ccf4a",
      "reason": "Tier mismatch: YELLOW -> YELLOW",
      "to_agent_id": "03a16db0-59aa-4eb9-9ed1-eb0cf4db64c7"
    },
    {
      "allowed": false,
      "from_agent_id": "2752f5c3-7930-4b54-880e-dc84c90ccf4a",
      "reason": "Tier mismatch: YELLOW -> BLACKHOLE",
      "to_agent_id": "2ebdb769-7004-4729-b923-7acc8cf054b7"
    },
    {
      "allowed": false,
      "from_agent_id": "2752f5c3-7930-4b54-880e-dc84c90ccf4a",
      "reason": "Tier mismatch: YELLOW -> YELLOW",
      "to_agent_id": "c3c5862f-8c0e-42fa-bf67-05b2730bddf2"
    },
    {
      "allowed": false,
      "from_agent_id": "2752f5c3-7930-4b54-880e-dc84c90ccf4a",
      "reason": "Tier mismatch: YELLOW -> BLACKHOLE",
      "to_agent_id": "8cc766fb-4816-4398-bd7a-9ebab7e71798"
    },
    {
      "allowed": false,
      "from_agent_id": "2752f5c3-7930-4b54-880e-dc84c90ccf4a",
      "reason": "Tier mismatch: YELLOW -> YELLOW",
      "to_agent_id": "2125ecac-d184-422b-a17b-3cade679f01b"
    },
    {
      "allowed": false,
      "from_agent_id": "001ef143-89b8-45bc-bf74-74ba1e415aad",
      "reason": "Tier mismatch: YELLOW -> BLACKHOLE",
      "to_agent_id": "a0402430-e269-4d95-93ee-621eb27bcafd"
    },
    {
      "allowed": false,
      "from_agent_id": "001ef143-89b8-45bc-bf74-74ba1e415aad",
      "reason": "Tier mismatch: YELLOW -> YELLOW",
      "to_agent_id": "2752f5c3-7930-4b54-880e-dc84c90ccf4a"
    },
    {
      "allowed": false,
      "from_agent_id": "001ef143-89b8-45bc-bf74-74ba1e415aad",
      "reason": "Tier mismatch: YELLOW -> YELLOW",
      "to_agent_id": "37395390-006b-469c-9a61-4c27bcb011a3"
    },
    {
      "allowed": false,
      "from_agent_id": "001ef143-89b8-45bc-bf74-74ba1e415aad",
      "reason": "Tier mismatch: YELLOW -> YELLOW",
      "to_agent_id": "03a16db0-59aa-4eb9-9ed1-eb0cf4db64c7"
    },
    {
      "allowed": false,
      "from_agent_id": "001ef143-89b8-45bc-bf74-74ba1e415aad",
      "reason": "Tier mismatch: YELLOW -> BLACKHOLE",
      "to_agent_id": "2ebdb769-7004-4729-b923-7acc8cf054b7"
    },
    {
      "allowed": false,
      "from_agent_id": "001ef143-89b8-45bc-bf74-74ba1e415aad",
      "reason": "Tier mismatch: YELLOW -> YELLOW",
      "to_agent_id": "c3c5862f-8c0e-42fa-bf67-05b2730bddf2"
    },
    {
      "allowed": false,
      "from_agent_id": "001ef143-89b8-45bc-bf74-74ba1e415aad",
      "reason": "Tier mismatch: YELLOW -> BLACKHOLE",
      "to_agent_id": "8cc766fb-4816-4398-bd7a-9ebab7e71798"
    },
    {
      "allowed": false,
      "from_agent_id": "001ef143-89b8-45bc-bf74-74ba1e415aad",
      "reason": "Tier mismatch: YELLOW -> YELLOW",
      "to_agent_id": "2125ecac-d184-422b-a17b-3cade679f01b"
    },
    {
      "allowed": false,
      "from_agent_id": "37395390-006b-469c-9a61-4c27bcb011a3",
      "reason": "Tier mismatch: YELLOW -> BLACKHOLE",
      "to_agent_id": "a0402430-e269-4d95-93ee-621eb27bcafd"
    },
    {
      "allowed": false,
      "from_agent_id": "37395390-006b-469c-9a61-4c27bcb011a3",
      "reason": "Tier mismatch: YELLOW -> YELLOW",
      "to_agent_id": "2752f5c3-7930-4b54-880e-dc84c90ccf4a"
    },
    {
      "allowed": false,
      "from_agent_id": "37395390-006b-469c-9a61-4c27bcb011a3",
      "reason": "Tier mismatch: YELLOW -> YELLOW",
      "to_agent_id": "001ef143-89b8-45bc-bf74-74ba1e415aad"
    },
    {
      "allowed": false,
      "from_agent_id": "37395390-006b-469c-9a61-4c27bcb011a3",
      "reason": "Tier mismatch: YELLOW -> YELLOW",
      "to_agent_id": "03a16db0-59aa-4eb9-9ed1-eb0cf4db64c7"
    },
    {
      "allowed": false,
      "from_agent_id": "37395390-006b-469c-9a61-4c27bcb011a3",
      "reason": "Tier mismatch: YELLOW -> BLACKHOLE",
      "to_agent_id": "2ebdb769-7004-4729-b923-7acc8cf054b7"
    },
    {
      "allowed": false,
      "from_agent_id": "37395390-006b-469c-9a61-4c27bcb011a3",
      "reason": "Tier mismatch: YELLOW -> YELLOW",
      "to_agent_id": "c3c5862f-8c0e-42fa-bf67-05b2730bddf2"
    },
    {
      "allowed": false,
      "from_agent_id": "37395390-006b-469c-9a61-4c27bcb011a3",
      "reason": "Tier mismatch: YELLOW -> BLACKHOLE",
      "to_agent_id": "8cc766fb-4816-4398-bd7a-9ebab7e71798"
    },
    {
      "allowed": false,
      "from_agent_id": "37395390-006b-469c-9a61-4c27bcb011a3",
      "reason": "Tier mismatch: YELLOW -> YELLOW",
      "to_agent_id": "2125ecac-d184-422b-a17b-3cade679f01b"
    },
    {
      "allowed": false,
      "from_agent_id": "03a16db0-59aa-4eb9-9ed1-eb0cf4db64c7",
      "reason": "Tier mismatch: YELLOW -> BLACKHOLE",
      "to_agent_id": "a0402430-e269-4d95-93ee-621eb27bcafd"
    },
    {
      "allowed": false,
      "from_agent_id": "03a16db0-59aa-4eb9-9ed1-eb0cf4db64c7",
      "reason": "Tier mismatch: YELLOW -> YELLOW",
      "to_agent_id": "2752f5c3-7930-4b54-880e-dc84c90ccf4a"
    },
    {
      "allowed": false,
      "from_agent_id": "03a16db0-59aa-4eb9-9ed1-eb0cf4db64c7",
      "reason": "Tier mismatch: YELLOW -> YELLOW",
      "to_agent_id": "001ef143-89b8-45bc-bf74-74ba1e415aad"
    },
    {
      "allowed": false,
      "from_agent_id": "03a16db0-59aa-4eb9-9ed1-eb0cf4db64c7",
      "reason": "Tier mismatch: YELLOW -> YELLOW",
      "to_agent_id": "37395390-006b-469c-9a61-4c27bcb011a3"
    },
    {
      "allowed": false,
      "from_agent_id": "03a16db0-59aa-4eb9-9ed1-eb0cf4db64c7",
      "reason": "Tier mismatch: YELLOW -> BLACKHOLE",
      "to_agent_id": "2ebdb769-7004-4729-b923-7acc8cf054b7"
    },
    {
      "allowed": false,
      "from_agent_id": "03a16db0-59aa-4eb9-9ed1-eb0cf4db64c7",
      "reason": "Tier mismatch: YELLOW -> YELLOW",
      "to_agent_id": "c3c5862f-8c0e-42fa-bf67-05b2730bddf2"
    },
    {
      "allowed": false,
      "from_agent_id": "03a16db0-59aa-4eb9-9ed1-eb0cf4db64c7",
      "reason": "Tier mismatch: YELLOW -> BLACKHOLE",
      "to_agent_id": "8cc766fb-4816-4398-bd7a-9ebab7e71798"
    },
    {
      "allowed": false,
      "from_agent_id": "03a16db0-59aa-4eb9-9ed1-eb0cf4db64c7",
      "reason": "Tier mismatch: YELLOW -> YELLOW",
      "to_agent_id": "2125ecac-d184-422b-a17b-3cade679f01b"
    },
    {
      "allowed": false,
      "from_agent_id": "2ebdb769-7004-4729-b923-7acc8cf054b7",
      "reason": "Tier mismatch: BLACKHOLE -> BLACKHOLE",
      "to_agent_id": "a0402430-e269-4d95-93ee-621eb27bcafd"
    },
    {
      "allowed": false,
      "from_agent_id": "2ebdb769-7004-4729-b923-7acc8cf054b7",